{
  "schemaVersion": "hospitalai.frontend-flow.v1",
  "metadata": {
    "scenarioId": "CAP-FULL-FLOW-2026-08",
    "name": "CAP 处方决策与科研闭环验证包",
    "version": "1.0.0",
    "generatedAt": "2026-08-03T08:00:00.000Z",
    "source": "HOSPITALAI_SYNTHETIC_IMPORT",
    "synthetic": true,
    "disclaimer": "全部记录均为合成模拟数据，仅用于产品流程验收，不构成临床或科研结论。"
  },
  "worklist": [
    { "encounterId": "E001", "patientId": "P001", "displayName": "合成患者A", "sex": "F", "age": 66, "department": "呼吸内科", "diagnosis": "社区获得性肺炎", "dataVersion": 3, "scenario": "normal", "admittedAt": "2026-08-03T08:10:00.000Z", "sourcePatientId": "HIS-P001" },
    { "encounterId": "E002-2", "patientId": "P002", "displayName": "合成患者B", "sex": "M", "age": 72, "department": "呼吸内科", "diagnosis": "社区获得性肺炎，第二次入院", "dataVersion": 4, "scenario": "confirmed_allergy_second_admission", "admittedAt": "2026-08-03T07:40:00.000Z", "sourcePatientId": "HIS-P002" },
    { "encounterId": "E005", "patientId": "P005", "displayName": "合成患者E", "sex": "F", "age": 81, "department": "呼吸内科", "diagnosis": "社区获得性肺炎", "dataVersion": 1, "scenario": "critical_lab_missing", "admittedAt": "2026-08-02T20:36:00.000Z", "sourcePatientId": "HIS-P005" }
  ],
  "workbenches": [
    {
      "patient": { "patientId": "P001", "displayName": "合成患者A", "sex": "F", "age": 66, "source": "HOSPITALAI_SYNTHETIC_IMPORT", "sourcePatientId": "HIS-P001" },
      "encounter": { "encounterId": "E001", "patientId": "P001", "department": "呼吸内科", "diagnosis": "社区获得性肺炎", "dataVersion": 3, "scenario": "normal" },
      "facts": [
        { "type": "diagnosis", "label": "当前诊断", "value": "社区获得性肺炎 / active", "source": "HIS_IMPORT", "sourceId": "HIS-DX-E001", "collectedAt": "2026-08-03T08:20:00.000Z", "missingStatus": "present" },
        { "type": "lab", "label": "肌酐", "value": "76 umol/L", "source": "LIS_IMPORT", "sourceId": "LIS-E001-CREA", "collectedAt": "2026-08-03T08:50:00.000Z", "missingStatus": "present" },
        { "type": "lab", "label": "C反应蛋白", "value": "42 mg/L", "source": "LIS_IMPORT", "sourceId": "LIS-E001-CRP", "collectedAt": "2026-08-03T08:50:00.000Z", "missingStatus": "present" },
        { "type": "medication", "label": "当前用药", "value": "0.9%氯化钠注射液 · 静脉滴注", "source": "HIS_IMPORT", "sourceId": "ORD-E001-001", "collectedAt": "2026-08-03T08:35:00.000Z", "missingStatus": "present" }
      ],
      "alerts": [],
      "candidates": [
        { "candidateId": "C-CEF-AZI", "name": "推荐方案", "drugCodes": ["D-CEF", "D-AZI"], "regimen": "头孢曲松 + 阿奇霉素，剂量由医生按已发布院内规则确认", "reason": "符合导入的 CAP 演示路径，患者关键检验完整", "difference": "联合方案；需持续监测心电风险和肝肾功能", "risks": [], "monitoring": ["过敏史", "肌酐", "CRP", "当前有效用药"], "evidence": [{ "evidenceId": "EV-CAP-001", "title": "CAP 演示证据集：住院成人初始治疗路径", "status": "published-demo", "version": "2026.08-demo", "effectiveDate": "2026-08-03", "locator": "第2页 · 初始方案 · 第3段", "text": "演示证据：候选必须来自院内目录，提交前复核过敏、检验和当前用药。", "score": 0.92 }], "excludedDrugs": ["万古霉素：不在当前导入目录可用范围"], "blocked": false },
        { "candidateId": "C-AMOX", "name": "备选方案", "drugCodes": ["D-AMOX"], "regimen": "阿莫西林克拉维酸钾，剂量由医生按已发布院内规则确认", "reason": "院内目录内备选，需继续确认青霉素过敏史", "difference": "单一药理类别方案；过敏风险边界不同", "risks": [], "monitoring": ["过敏史", "肾功能"], "evidence": [{ "evidenceId": "EV-CAP-001", "title": "CAP 演示证据集：住院成人初始治疗路径", "status": "published-demo", "version": "2026.08-demo", "effectiveDate": "2026-08-03", "locator": "第2页 · 初始方案 · 第3段", "text": "演示证据：候选必须来自院内目录，提交前复核过敏、检验和当前用药。", "score": 0.86 }], "excludedDrugs": [], "blocked": false },
        { "candidateId": "C-LEV", "name": "特定条件方案", "drugCodes": ["D-LEV"], "regimen": "左氧氟沙星，剂量由医生按已发布院内规则确认", "reason": "仅作为特定条件下的可比较候选", "difference": "需额外复核既往不良反应和心电风险", "risks": ["需药师复核特定风险"], "monitoring": ["不良反应史", "肾功能", "心电风险"], "evidence": [{ "evidenceId": "EV-CAP-002", "title": "CAP 演示证据集：监测要求", "status": "published-demo", "version": "2026.08-demo", "effectiveDate": "2026-08-03", "locator": "第4页 · 监测项目 · 表2", "text": "演示证据：特定条件候选需加强不良反应与心电监测。", "score": 0.78 }], "excludedDrugs": [], "blocked": false }
      ],
      "missingInfo": [],
      "stages": [
        { "name": "patient_context", "status": "complete", "elapsedMs": 82, "detail": "导入患者事实已汇总，原始事实保持只读" },
        { "name": "deterministic_rules", "status": "complete", "elapsedMs": 146, "detail": "确定性安全规则执行完成" },
        { "name": "controlled_evidence", "status": "complete", "elapsedMs": 324, "detail": "受控演示证据检索完成" },
        { "name": "candidate_ranking", "status": "complete", "elapsedMs": 418, "detail": "目录内候选排序完成" }
      ],
      "recommendationId": "REC-E001-v3",
      "aiStatus": "deterministic-import"
    },
    {
      "patient": { "patientId": "P002", "displayName": "合成患者B", "sex": "M", "age": 72, "source": "HOSPITALAI_SYNTHETIC_IMPORT", "sourcePatientId": "HIS-P002" },
      "encounter": { "encounterId": "E002-2", "patientId": "P002", "department": "呼吸内科", "diagnosis": "社区获得性肺炎，第二次入院", "dataVersion": 4, "scenario": "confirmed_allergy_second_admission" },
      "facts": [
        { "type": "diagnosis", "label": "当前诊断", "value": "社区获得性肺炎 / active", "source": "HIS_IMPORT", "sourceId": "HIS-DX-E002-2", "collectedAt": "2026-08-03T07:50:00.000Z", "missingStatus": "present" },
        { "type": "allergy", "label": "历史确认过敏", "value": "阿莫西林克拉维酸钾 · 确认 · 首次住院记录", "source": "EMR_IMPORT", "sourceId": "ALG-P002-AMOX", "collectedAt": "2026-03-18T09:30:00.000Z", "missingStatus": "present" },
        { "type": "lab", "label": "肌酐", "value": "88 umol/L", "source": "LIS_IMPORT", "sourceId": "LIS-E002-CREA", "collectedAt": "2026-08-03T08:10:00.000Z", "missingStatus": "present" }
      ],
      "alerts": [{ "ruleId": "HR-ALG-001", "version": "2026.08", "status": "published-demo", "level": "block", "message": "已确认药物过敏：后续就诊继承并阻断阿莫西林克拉维酸钾", "facts": ["ALG-P002-AMOX"], "blocking": true }],
      "candidates": [
        { "candidateId": "C-CEF-AZI", "name": "待风险澄清方案", "drugCodes": ["D-CEF", "D-AZI"], "regimen": "头孢曲松 + 阿奇霉素，需先完成过敏交叉风险人工核对", "reason": "存在历史确认过敏，当前推荐整体被处方草稿硬锁定", "difference": "不得在未处理阻断前创建草稿", "risks": ["患者级硬阻断尚未解除"], "monitoring": ["过敏史", "药师复核"], "evidence": [{ "evidenceId": "EV-CAP-001", "title": "CAP 演示证据集：住院成人初始治疗路径", "status": "published-demo", "version": "2026.08-demo", "effectiveDate": "2026-08-03", "locator": "第2页 · 初始方案 · 第3段", "text": "确认过敏优先执行确定性规则。", "score": 0.92 }], "excludedDrugs": [], "blocked": true },
        { "candidateId": "C-AMOX", "name": "已排除方案", "drugCodes": ["D-AMOX"], "regimen": "阿莫西林克拉维酸钾", "reason": "命中跨就诊继承的已确认过敏，禁止提交", "difference": "与患者确认过敏药物直接匹配", "risks": ["已确认药物过敏硬阻断"], "monitoring": ["不适用"], "evidence": [{ "evidenceId": "EV-CAP-001", "title": "CAP 演示证据集：住院成人初始治疗路径", "status": "published-demo", "version": "2026.08-demo", "effectiveDate": "2026-08-03", "locator": "第2页 · 安全边界", "text": "确认过敏药物不得作为可提交候选。", "score": 1.0 }], "excludedDrugs": ["阿莫西林克拉维酸钾：确认过敏"], "blocked": true }
      ],
      "missingInfo": [],
      "stages": [
        { "name": "patient_context", "status": "complete", "elapsedMs": 76, "detail": "跨就诊过敏事实已继承" },
        { "name": "deterministic_rules", "status": "blocked", "elapsedMs": 91, "detail": "HR-ALG-001 硬阻断" },
        { "name": "controlled_evidence", "status": "complete", "elapsedMs": 210, "detail": "已定位阻断依据" },
        { "name": "candidate_ranking", "status": "complete", "elapsedMs": 264, "detail": "候选仅用于风险比较，不可提交" }
      ],
      "recommendationId": "REC-E002-2-v4",
      "aiStatus": "deterministic-import"
    },
    {
      "patient": { "patientId": "P005", "displayName": "合成患者E", "sex": "F", "age": 81, "source": "HOSPITALAI_SYNTHETIC_IMPORT", "sourcePatientId": "HIS-P005" },
      "encounter": { "encounterId": "E005", "patientId": "P005", "department": "呼吸内科", "diagnosis": "社区获得性肺炎", "dataVersion": 1, "scenario": "critical_lab_missing" },
      "facts": [
        { "type": "diagnosis", "label": "当前诊断", "value": "社区获得性肺炎 / active", "source": "HIS_IMPORT", "sourceId": "HIS-DX-E005", "collectedAt": "2026-08-02T20:45:00.000Z", "missingStatus": "present" },
        { "type": "lab", "label": "肌酐", "value": "未知", "source": "LIS_IMPORT", "sourceId": "MISS-E005-CREA", "collectedAt": "2026-08-02T20:50:00.000Z", "missingStatus": "missing" },
        { "type": "lab", "label": "C反应蛋白", "value": "未知", "source": "LIS_IMPORT", "sourceId": "MISS-E005-CRP", "collectedAt": "2026-08-02T20:50:00.000Z", "missingStatus": "missing" }
      ],
      "alerts": [
        { "ruleId": "HR-MISS-001", "version": "2026.08", "status": "published-demo", "level": "info", "message": "关键检验缺失：C反应蛋白，不得按正常值处理", "facts": ["MISS-E005-CRP"], "blocking": false },
        { "ruleId": "HR-MISS-001", "version": "2026.08", "status": "published-demo", "level": "info", "message": "关键检验缺失：肌酐，不得按正常值处理", "facts": ["MISS-E005-CREA"], "blocking": false }
      ],
      "candidates": [
        { "candidateId": "C-CEF-AZI", "name": "信息待补方案", "drugCodes": ["D-CEF", "D-AZI"], "regimen": "头孢曲松 + 阿奇霉素，待关键检验补齐后由医生确认", "reason": "候选仅供比较，关键检验未知", "difference": "不能把缺失检验解释为正常", "risks": ["关键检验缺失"], "monitoring": ["肌酐", "CRP", "补采检验"], "evidence": [{ "evidenceId": "EV-CAP-002", "title": "CAP 演示证据集：监测要求", "status": "published-demo", "version": "2026.08-demo", "effectiveDate": "2026-08-03", "locator": "第4页 · 监测项目 · 表2", "text": "关键检验缺失时必须显式标注。", "score": 0.88 }], "excludedDrugs": [], "blocked": false },
        { "candidateId": "C-LEV", "name": "特定条件方案", "drugCodes": ["D-LEV"], "regimen": "左氧氟沙星，待肾功能补齐后再评估", "reason": "肾功能未知，无法完成适用性评估", "difference": "需要更多患者信息", "risks": ["肾功能未知"], "monitoring": ["肌酐", "心电风险"], "evidence": [{ "evidenceId": "EV-CAP-002", "title": "CAP 演示证据集：监测要求", "status": "published-demo", "version": "2026.08-demo", "effectiveDate": "2026-08-03", "locator": "第4页 · 监测项目 · 表2", "text": "未知值不得当作正常值参与排序。", "score": 0.82 }], "excludedDrugs": [], "blocked": false }
      ],
      "missingInfo": ["肌酐缺失，来源 LIS_IMPORT", "C反应蛋白缺失，来源 LIS_IMPORT"],
      "stages": [
        { "name": "patient_context", "status": "complete", "elapsedMs": 71, "detail": "缺失事实已结构化" },